{"schemaVersion":1,"ok":true,"meshRevision":null,"session":{"hostId":"local","serverGeneration":"tmux-v1:1722741000:1234:/run/user/1000/tmux-1000/default","sessionId":"$6","createdAt":1722742000,"name":"rofi-tmux-plus","activityAt":1722743000,"lastAttachedAt":null,"attachedClients":2,"pending":false,"windowCount":1,"sessionPath":"/home/user","currentWindow":"editor","currentPath":"/home/user/code/rofi-tmux-plus"},"focused":true,"terminalLaunched":false}
